{
  "schemaVersion": 1,
  "channel": "preview",
  "applicationId": "app.polka",
  "release": {
    "versionCode": 129,
    "versionName": "0.2.124",
    "publishedAt": "2026-11-01T14:09:19Z",
    "notes": [
      "# PluriBooks 0.2.124",
      "- Для разделов Предания с полностью объявленным списком файлов доступна загрузка отдельными главами и просмотр их списка. Полная запись и соседние постановки не смешиваются; при неполном списке остаётся прежний архив конкретного раздела.",
      "- После ошибки или отмены поиск показывает, сколько глав уже сохранено. При тайм-ауте следующей страницы каталога найденные проверенные записи сохраняются.",
      "- Старые ZIP-загрузки продолжают использовать свой кэш и способ восстановления, сохраняя прежнюю привязку прогресса.",
      "- Отдельные аудиофайлы, включая M4B, больше не подписаны как ZIP в загрузках.",
      "Проверена реальная загрузка русской аудиокниги «Студент» Чехова из Азбуки веры, добавление в библиотеку и воспроизведение. При текущей проверке Предание возвращало неполный ответ карточки «Героя нашего времени»; полную загрузку этой записи подтвердить не удалось.",
      "Устанавливайте поверх текущей версии: пакет и подпись сохранены. Тестовый preview-выпуск."
    ],
    "releaseUrl": "https://github.com/EraserHead8/pluribooks-distribution/releases/tag/v0.2.124",
    "minSdk": 26,
    "apk": {
      "url": "https://github.com/EraserHead8/pluribooks-distribution/releases/download/v0.2.124/PluriBooks-0.2.124-debug.apk",
      "sha256": "97eced7fc716913870a478a80157ac92144313b55ccf5e780c53f9e960f8d385",
      "sizeBytes": 26228459
    }
  }
}
